[
  {
    "id": "armour-of-contempt",
    "name": "Armour of Contempt",
    "category": "detachment",
    "type": "battle-tactic",
    "detachment_id": "blade-of-ultramar",
    "cp_cost": 1,
    "phases": [
      "shooting",
      "fight"
    ],
    "player_turn": "opponent-turn",
    "timing": "once-per-phase",
    "target_restrictions": null,
    "ability_id": null,
    "game_version": {
      "edition": "11th",
      "dataslate": "pre-launch-provisional"
    }
  },
  {
    "id": "ultramarian-adaptivity",
    "name": "Ultramarian Adaptivity",
    "category": "detachment",
    "type": "strategic-ploy",
    "detachment_id": "blade-of-ultramar",
    "cp_cost": 1,
    "phases": [
      "command"
    ],
    "player_turn": "your-turn",
    "timing": "once-per-phase",
    "target_restrictions": null,
    "ability_id": null,
    "game_version": {
      "edition": "11th",
      "dataslate": "pre-launch-provisional"
    }
  },
  {
    "id": "exemplary-vigilance",
    "name": "Exemplary Vigilance",
    "category": "detachment",
    "type": "battle-tactic",
    "detachment_id": "blade-of-ultramar",
    "cp_cost": 1,
    "phases": [
      "shooting"
    ],
    "player_turn": "your-turn",
    "timing": "once-per-phase",
    "target_restrictions": null,
    "ability_id": null,
    "game_version": {
      "edition": "11th",
      "dataslate": "pre-launch-provisional"
    }
  },
  {
    "id": "tactical-foresight",
    "name": "Tactical Foresight",
    "category": "detachment",
    "type": "epic-deed",
    "detachment_id": "blade-of-ultramar",
    "cp_cost": 1,
    "phases": [
      "shooting",
      "fight"
    ],
    "player_turn": "opponent-turn",
    "timing": "once-per-phase",
    "target_restrictions": null,
    "ability_id": null,
    "game_version": {
      "edition": "11th",
      "dataslate": "pre-launch-provisional"
    }
  },
  {
    "id": "practical-tactics",
    "name": "Practical Tactics",
    "category": "detachment",
    "type": "strategic-ploy",
    "detachment_id": "blade-of-ultramar",
    "cp_cost": 1,
    "phases": [
      "movement"
    ],
    "player_turn": "opponent-turn",
    "timing": "once-per-phase",
    "target_restrictions": null,
    "ability_id": null,
    "game_version": {
      "edition": "11th",
      "dataslate": "pre-launch-provisional"
    }
  },
  {
    "id": "courage-and-honour",
    "name": "Courage and Honour!",
    "category": "detachment",
    "type": "battle-tactic",
    "detachment_id": "blade-of-ultramar",
    "cp_cost": 1,
    "phases": [
      "fight"
    ],
    "player_turn": "either",
    "timing": "once-per-phase",
    "target_restrictions": null,
    "ability_id": null,
    "game_version": {
      "edition": "11th",
      "dataslate": "pre-launch-provisional"
    }
  }
]
