[
  {
    "id": "armour-of-contempt",
    "name": "ARMOUR OF CONTEMPT",
    "category": "detachment",
    "type": "battle-tactic",
    "detachment_id": "black-spear-task-force",
    "cp_cost": 1,
    "phases": [
      "fight",
      "shooting"
    ],
    "player_turn": "either",
    "timing": "once-per-phase",
    "target_restrictions": null,
    "ability_id": null,
    "game_version": {
      "edition": "11th",
      "dataslate": "pre-launch-provisional"
    }
  },
  {
    "id": "adaptive-tactics",
    "name": "ADAPTIVE TACTICS",
    "category": "detachment",
    "type": "strategic-ploy",
    "detachment_id": "black-spear-task-force",
    "cp_cost": 1,
    "phases": [
      "command"
    ],
    "player_turn": "your-turn",
    "timing": "once-per-phase",
    "target_restrictions": null,
    "ability_id": null,
    "game_version": {
      "edition": "11th",
      "dataslate": "pre-launch-provisional"
    }
  },
  {
    "id": "site-to-site-teleportation",
    "name": "SITE-TO-SITE TELEPORTATION",
    "category": "detachment",
    "type": "strategic-ploy",
    "detachment_id": "black-spear-task-force",
    "cp_cost": 1,
    "phases": [
      "fight"
    ],
    "player_turn": "opponent-turn",
    "timing": "once-per-phase",
    "target_restrictions": null,
    "ability_id": null,
    "game_version": {
      "edition": "11th",
      "dataslate": "pre-launch-provisional"
    }
  },
  {
    "id": "hellfire-rounds",
    "name": "HELLFIRE ROUNDS",
    "category": "detachment",
    "type": "wargear",
    "detachment_id": "black-spear-task-force",
    "cp_cost": 1,
    "phases": [
      "shooting"
    ],
    "player_turn": "your-turn",
    "timing": "once-per-phase",
    "target_restrictions": null,
    "ability_id": null,
    "game_version": {
      "edition": "11th",
      "dataslate": "pre-launch-provisional"
    }
  },
  {
    "id": "kraken-rounds",
    "name": "KRAKEN ROUNDS",
    "category": "detachment",
    "type": "wargear",
    "detachment_id": "black-spear-task-force",
    "cp_cost": 1,
    "phases": [
      "shooting"
    ],
    "player_turn": "your-turn",
    "timing": "once-per-phase",
    "target_restrictions": null,
    "ability_id": null,
    "game_version": {
      "edition": "11th",
      "dataslate": "pre-launch-provisional"
    }
  },
  {
    "id": "dragonfire-rounds",
    "name": "DRAGONFIRE ROUNDS",
    "category": "detachment",
    "type": "wargear",
    "detachment_id": "black-spear-task-force",
    "cp_cost": 1,
    "phases": [
      "shooting"
    ],
    "player_turn": "your-turn",
    "timing": "once-per-phase",
    "target_restrictions": null,
    "ability_id": null,
    "game_version": {
      "edition": "11th",
      "dataslate": "pre-launch-provisional"
    }
  }
]
